#queryIndex	queryItem	stringId	identity	bitscore	preferredName	annotation
1389	fig|6666666.1036479.peg.1550	1041826.FCOL_10100	93.3	408.7	AEW86829.1	MIP family channel protein; COG0580 Glycerol uptake facilitator and related permeases (Major Intrinsic Protein Family); Belongs to the MIP/aquaporin (TC 1.A.8) family.
1390	fig|6666666.1036479.peg.1552	1041826.FCOL_10095	88.2	535.4	AEW86828.1	Bifunctional riboflavin kinase/FMN adenylyltransferase; COG0196 FAD synthase; Belongs to the ribF family.
1391	fig|6666666.1036479.peg.1553	1041826.FCOL_10090	85.1	845.9	AEW86827.1	Hypothetical protein.
1392	fig|6666666.1036479.peg.1555	1041826.FCOL_10085	95.7	2505.7	AEW86826.1	COG2176 DNA polymerase III, alpha subunit (gram-positive type).
1393	fig|6666666.1036479.peg.1559	1041826.FCOL_10070	90.4	622.5	AEW86823.1	ABC transporter permease; COG4591 ABC-type transport system, involved in lipoprotein release, permease component.
1395	fig|6666666.1036479.peg.1572	1041826.FCOL_09845	64.0	70.9	AEW86778.1	YD repeat-containing protein; COG3209 Rhs family protein.
1397	fig|6666666.1036479.peg.1575	1041826.FCOL_09875	79.5	543.5	AEW86784.1	Tyrosine recombinase XerD; COG0582 Integrase; Belongs to the 'phage' integrase family.
1398	fig|6666666.1036479.peg.1576	1041826.FCOL_09870	32.0	176.4	AEW86783.1	Hypothetical protein.
1400	fig|6666666.1036479.peg.1582	1041826.FCOL_09845	61.2	72.0	AEW86778.1	YD repeat-containing protein; COG3209 Rhs family protein.
1401	fig|6666666.1036479.peg.1584	1041826.FCOL_05530	98.3	713.0	AEW85931.1	Integrase catalytic subunit; COG2801 Transposase and inactivated derivatives.
1403	fig|6666666.1036479.peg.1587	1041826.FCOL_09880	96.5	501.1	AEW86785.1	Integrase family protein; COG4973 Site-specific recombinase XerC; Belongs to the 'phage' integrase family.
1404	fig|6666666.1036479.peg.1588	1041826.FCOL_09875	79.5	543.5	AEW86784.1	Tyrosine recombinase XerD; COG0582 Integrase; Belongs to the 'phage' integrase family.
1405	fig|6666666.1036479.peg.1589	1041826.FCOL_09870	32.0	176.4	AEW86783.1	Hypothetical protein.
1407	fig|6666666.1036479.peg.1595	1041826.FCOL_09845	71.7	94.4	AEW86778.1	YD repeat-containing protein; COG3209 Rhs family protein.
1409	fig|6666666.1036479.peg.1598	1041826.FCOL_09880	96.9	500.4	AEW86785.1	Integrase family protein; COG4973 Site-specific recombinase XerC; Belongs to the 'phage' integrase family.
1410	fig|6666666.1036479.peg.1599	1041826.FCOL_09875	87.2	598.2	AEW86784.1	Tyrosine recombinase XerD; COG0582 Integrase; Belongs to the 'phage' integrase family.
1411	fig|6666666.1036479.peg.1600	1041826.FCOL_09870	87.8	888.3	AEW86783.1	Hypothetical protein.
1412	fig|6666666.1036479.peg.1604	1041826.FCOL_09845	50.0	59.3	AEW86778.1	YD repeat-containing protein; COG3209 Rhs family protein.
1413	fig|6666666.1036479.peg.1605	1041826.FCOL_09880	96.9	500.4	AEW86785.1	Integrase family protein; COG4973 Site-specific recombinase XerC; Belongs to the 'phage' integrase family.
1414	fig|6666666.1036479.peg.1606	1041826.FCOL_09875	87.2	598.2	AEW86784.1	Tyrosine recombinase XerD; COG0582 Integrase; Belongs to the 'phage' integrase family.
1415	fig|6666666.1036479.peg.1607	1041826.FCOL_09870	87.8	888.3	AEW86783.1	Hypothetical protein.
1416	fig|6666666.1036479.peg.1611	1041826.FCOL_09845	50.0	59.3	AEW86778.1	YD repeat-containing protein; COG3209 Rhs family protein.
1417	fig|6666666.1036479.peg.1613	1041826.FCOL_09880	100.0	517.3	AEW86785.1	Integrase family protein; COG4973 Site-specific recombinase XerC; Belongs to the 'phage' integrase family.
1418	fig|6666666.1036479.peg.1614	1041826.FCOL_09875	100.0	681.0	AEW86784.1	Tyrosine recombinase XerD; COG0582 Integrase; Belongs to the 'phage' integrase family.
1419	fig|6666666.1036479.peg.1615	1041826.FCOL_09870	100.0	995.0	AEW86783.1	Hypothetical protein.
1421	fig|6666666.1036479.peg.1618	1041826.FCOL_09845	78.8	139.8	AEW86778.1	YD repeat-containing protein; COG3209 Rhs family protein.
1423	fig|6666666.1036479.peg.1621	1041826.FCOL_09880	100.0	517.3	AEW86785.1	Integrase family protein; COG4973 Site-specific recombinase XerC; Belongs to the 'phage' integrase family.
1424	fig|6666666.1036479.peg.1622	1041826.FCOL_09875	100.0	681.0	AEW86784.1	Tyrosine recombinase XerD; COG0582 Integrase; Belongs to the 'phage' integrase family.
1425	fig|6666666.1036479.peg.1623	1041826.FCOL_09870	100.0	995.0	AEW86783.1	Hypothetical protein.
1427	fig|6666666.1036479.peg.1626	1041826.FCOL_09845	78.8	139.8	AEW86778.1	YD repeat-containing protein; COG3209 Rhs family protein.
1428	fig|6666666.1036479.peg.1627	1041826.FCOL_05530	99.3	570.1	AEW85931.1	Integrase catalytic subunit; COG2801 Transposase and inactivated derivatives.
1429	fig|6666666.1036479.peg.1628	1041826.FCOL_09880	93.3	482.6	AEW86785.1	Integrase family protein; COG4973 Site-specific recombinase XerC; Belongs to the 'phage' integrase family.
1430	fig|6666666.1036479.peg.1629	1041826.FCOL_09875	91.3	627.9	AEW86784.1	Tyrosine recombinase XerD; COG0582 Integrase; Belongs to the 'phage' integrase family.
1431	fig|6666666.1036479.peg.1630	1041826.FCOL_09870	86.9	877.1	AEW86783.1	Hypothetical protein.
1433	fig|6666666.1036479.peg.1634	1041826.FCOL_05530	98.3	713.0	AEW85931.1	Integrase catalytic subunit; COG2801 Transposase and inactivated derivatives.
1434	fig|6666666.1036479.peg.1635	1041826.FCOL_09880	93.0	486.9	AEW86785.1	Integrase family protein; COG4973 Site-specific recombinase XerC; Belongs to the 'phage' integrase family.
1435	fig|6666666.1036479.peg.1636	1041826.FCOL_09875	91.3	627.9	AEW86784.1	Tyrosine recombinase XerD; COG0582 Integrase; Belongs to the 'phage' integrase family.
1436	fig|6666666.1036479.peg.1637	1041826.FCOL_09870	86.9	877.1	AEW86783.1	Hypothetical protein.
1439	fig|6666666.1036479.peg.1644	1041826.FCOL_09880	94.2	486.1	AEW86785.1	Integrase family protein; COG4973 Site-specific recombinase XerC; Belongs to the 'phage' integrase family.
1440	fig|6666666.1036479.peg.1645	1041826.FCOL_09875	95.3	651.4	AEW86784.1	Tyrosine recombinase XerD; COG0582 Integrase; Belongs to the 'phage' integrase family.
1441	fig|6666666.1036479.peg.1646	1041826.FCOL_09870	87.6	883.6	AEW86783.1	Hypothetical protein.
1442	fig|6666666.1036479.peg.1649	1041826.FCOL_09845	49.2	119.8	AEW86778.1	YD repeat-containing protein; COG3209 Rhs family protein.
1443	fig|6666666.1036479.peg.1650	1041826.FCOL_09880	94.2	486.1	AEW86785.1	Integrase family protein; COG4973 Site-specific recombinase XerC; Belongs to the 'phage' integrase family.
1444	fig|6666666.1036479.peg.1651	1041826.FCOL_09875	95.3	651.4	AEW86784.1	Tyrosine recombinase XerD; COG0582 Integrase; Belongs to the 'phage' integrase family.
1445	fig|6666666.1036479.peg.1652	1041826.FCOL_09870	87.6	883.6	AEW86783.1	Hypothetical protein.
1446	fig|6666666.1036479.peg.1656	1041826.FCOL_09845	30.1	1337.0	AEW86778.1	YD repeat-containing protein; COG3209 Rhs family protein.
1448	fig|6666666.1036479.peg.1658	1041826.FCOL_09835	44.6	157.9	AEW86776.1	PKD domain-containing protein.
1449	fig|6666666.1036479.peg.1659	1041826.FCOL_09830	42.1	1241.9	AEW86775.1	Hypothetical protein.
1450	fig|6666666.1036479.peg.1660	1041826.FCOL_09825	97.0	393.7	AEW86774.1	Hypothetical protein.
1451	fig|6666666.1036479.peg.1662	1041826.FCOL_09815	81.0	305.8	AEW86772.1	COG2849 Uncharacterized protein conserved in bacteria.
1452	fig|6666666.1036479.peg.1663	1041826.FCOL_09810	83.3	620.5	AEW86771.2	Hypothetical protein.
1453	fig|6666666.1036479.peg.1666	1041826.FCOL_09795	85.5	562.0	AEW86768.1	Type II secretion system protein; COG1459 Type II secretory pathway, component PulF.
1454	fig|6666666.1036479.peg.1667	1041826.FCOL_10065	98.0	787.3	AEW86822.1	COG1960 Acyl-CoA dehydrogenases.
1455	fig|6666666.1036479.peg.1668	1041826.FCOL_10060	90.6	468.0	AEW86821.1	Hypothetical protein.
1456	fig|6666666.1036479.peg.1670	1041826.FCOL_10050	87.7	557.4	AEW86819.1	Hypothetical protein.
1457	fig|6666666.1036479.peg.1672	1041826.FCOL_09945	76.9	500.4	AEW86798.1	Fibronectin, type III domain-containing protein.
1458	fig|6666666.1036479.peg.1674	1041826.FCOL_09935	70.8	553.9	AEW86796.1	Hypothetical protein.
1459	fig|6666666.1036479.peg.1675	1041826.FCOL_09930	92.7	1144.8	AEW86795.1	Type II and III secretion system protein; COG4796 Type II secretory pathway, component HofQ; Belongs to the bacterial secretin family.
1460	fig|6666666.1036479.peg.1676	1041826.FCOL_09925	85.9	798.1	AEW86794.1	COG2804 Type II secretory pathway, ATPase PulE/Tfp pilus assembly pathway, ATPase PilB.
1461	fig|6666666.1036479.peg.1679	1041826.FCOL_09910	86.5	763.1	AEW86791.2	Hypothetical protein.
1462	fig|6666666.1036479.peg.1680	1041826.FCOL_09985	94.6	1765.7	AEW86806.1	COG4771 Outer membrane receptor for ferrienterochelin and colicins.
1463	fig|6666666.1036479.peg.1681	1041826.FCOL_09980	82.6	954.5	pgi	COG0166 Glucose-6-phosphate isomerase; Belongs to the GPI family.
1464	fig|6666666.1036479.peg.1682	1041826.FCOL_09975	95.1	610.9	AEW86804.1	COG3483 Tryptophan 2,3-dioxygenase (vermilion).
1465	fig|6666666.1036479.peg.1683	1041826.FCOL_09970	93.1	493.8	AEW86803.1	Hypothetical protein.
1466	fig|6666666.1036479.peg.1684	1041826.FCOL_09965	92.0	604.0	AEW86802.1	COG0180 Tryptophanyl-tRNA synthetase; Belongs to the class-I aminoacyl-tRNA synthetase family.
1467	fig|6666666.1036479.peg.1685	1041826.FCOL_09960	91.5	478.8	AEW86801.1	COG0204 1-acyl-sn-glycerol-3-phosphate acyltransferase; Belongs to the 1-acyl-sn-glycerol-3-phosphate acyltransferase family.
1468	fig|6666666.1036479.peg.1686	1041826.FCOL_09955	92.6	2062.7	AEW86800.1	Glycosyl hydrolase, BNR repeat protein; COG1404 Subtilisin-like serine proteases.
1469	fig|6666666.1036479.peg.1687	1041826.FCOL_09530	99.3	687.6	AEW86715.1	Magnesium transporter mgtE; Acts as a magnesium transporter.
1470	fig|6666666.1036479.peg.1688	1041826.FCOL_09525	98.5	505.8	ksgA	16S ribosomal RNA methyltransferase KsgA/Dim1 family protein; Specifically dimethylates two adjacent adenosines (A1518 and A1519) in the loop of a conserved hairpin near the 3'-end of 16S rRNA in the 30S particle. May play a critical role in biogenesis of 30S subunits.
1471	fig|6666666.1036479.peg.1691	1041826.FCOL_09515	94.9	1103.2	AEW86712.1	Hypothetical protein; COG0457 FOG: TPR repeat.
1472	fig|6666666.1036479.peg.1692	1041826.FCOL_09510	92.3	748.0	AEW86711.1	COG0172 Seryl-tRNA synthetase.
1473	fig|6666666.1036479.peg.1694	1041826.FCOL_09500	86.3	792.0	AEW86709.2	Multi anti extrusion protein MatE; COG2244 Membrane protein involved in the export of O-antigen and teichoic acid.
1474	fig|6666666.1036479.peg.1696	1041826.FCOL_09490	97.9	569.3	AEW86707.1	Sugar phosphate nucleotidyl transferase; COG1209 dTDP-glucose pyrophosphorylase.
1475	fig|6666666.1036479.peg.1697	1041826.FCOL_09485	94.4	846.7	AEW86706.1	Hypothetical protein; COG0457 FOG: TPR repeat.
1476	fig|6666666.1036479.peg.1698	1041826.FCOL_09480	92.3	471.9	AEW86705.1	Hypothetical protein.
1477	fig|6666666.1036479.peg.1699	1041826.FCOL_09475	97.9	607.1	AEW86704.1	M23/M37 family peptidase; COG4942 Membrane-bound metallopeptidase.
1478	fig|6666666.1036479.peg.1702	1041826.FCOL_09460	98.5	666.0	AEW86701.1	acyl-ACP desaturase.
1479	fig|6666666.1036479.peg.1703	1041826.FCOL_09455	92.5	402.5	AEW86700.1	Hydrolase; COG1418 Predicted HD superfamily hydrolase.
1480	fig|6666666.1036479.peg.1705	1041826.FCOL_07380	95.0	196.4	AEW86295.1	Hypothetical protein; COG3328 Transposase and inactivated derivatives.
1481	fig|6666666.1036479.peg.1707	1041826.FCOL_09640	99.1	768.1	AEW86737.1	Multidrug resistance protein precursor AcrB/AcrD/AcrF family protein; COG0841 Cation/multidrug efflux pump; Belongs to the resistance-nodulation-cell division (RND) (TC 2.A.6) family.
1482	fig|6666666.1036479.peg.1708	1041826.FCOL_09640	95.3	676.8	AEW86737.1	Multidrug resistance protein precursor AcrB/AcrD/AcrF family protein; COG0841 Cation/multidrug efflux pump; Belongs to the resistance-nodulation-cell division (RND) (TC 2.A.6) family.
1483	fig|6666666.1036479.peg.1710	1041826.FCOL_09635	96.3	690.3	AEW86736.1	COG0845 Membrane-fusion protein; Belongs to the membrane fusion protein (MFP) (TC 8.A.1) family.
1484	fig|6666666.1036479.peg.1711	1041826.FCOL_09630	90.0	739.2	AEW86735.1	COG1538 Outer membrane protein.
1485	fig|6666666.1036479.peg.1712	1041826.FCOL_09625	96.5	375.2	AEW86734.1	COG1309 Transcriptional regulator.
1486	fig|6666666.1036479.peg.1713	1041826.FCOL_09620	97.7	502.3	AEW86733.1	Short-chain dehydrogenase/reductase sdr; COG0300 Short-chain dehydrogenases of various substrate specificities; Belongs to the short-chain dehydrogenases/reductases (SDR) family.
1487	fig|6666666.1036479.peg.1714	1041826.FCOL_09615	92.0	580.5	AEW86732.1	Polyprenyl synthetase; COG0142 Geranylgeranyl pyrophosphate synthase; Belongs to the FPP/GGPP synthase family.
1488	fig|6666666.1036479.peg.1716	1041826.FCOL_09605	95.2	883.6	AEW86730.1	COG3540 Phosphodiesterase/alkaline phosphatase D.
1489	fig|6666666.1036479.peg.1717	1041826.FCOL_09600	95.1	745.0	AEW86729.1	COG0477 Permeases of the major facilitator superfamily.
1490	fig|6666666.1036479.peg.1718	1041826.FCOL_09595	86.9	456.8	AEW86728.1	Hypothetical protein.
1491	fig|6666666.1036479.peg.1720	1041826.FCOL_09585	92.6	1718.7	sucA	COG0567 2-oxoglutarate dehydrogenase complex, dehydrogenase (E1) component, and related enzymes.
1492	fig|6666666.1036479.peg.1721	1041826.FCOL_09580	98.5	743.8	AEW86725.1	Dihydrolipoyllysine-residue succinyltransferase component of 2-oxoglutarate dehydrogenase complex; E2 component of the 2-oxoglutarate dehydrogenase (OGDH) complex which catalyzes the second step in the conversion of 2- oxoglutarate to succinyl-CoA and CO(2).
1493	fig|6666666.1036479.peg.1722	1041826.FCOL_09575	64.1	1518.8	AEW86724.1	N-6 DNA methylase; COG0059 Ketol-acid reductoisomerase.
1494	fig|6666666.1036479.peg.1723	1041826.FCOL_09570	99.0	785.4	AEW86723.1	COG0477 Permeases of the major facilitator superfamily.
1495	fig|6666666.1036479.peg.1724	1041826.FCOL_09565	97.2	535.0	AEW86722.1	UDP-2,3-diacylglucosamine hydrolase; COG2908 Uncharacterized protein conserved in bacteria.
1496	fig|6666666.1036479.peg.1725	1041826.FCOL_09560	96.0	626.7	AEW86721.1	1-phosphatidylinositol phosphodiesterase.
1497	fig|6666666.1036479.peg.1727	1041826.FCOL_09555	96.3	1470.7	AEW86720.1	COG4206 Outer membrane cobalamin receptor protein.
1498	fig|6666666.1036479.peg.1728	1041826.FCOL_09550	89.7	589.0	AEW86719.1	COG0111 Phosphoglycerate dehydrogenase and related dehydrogenases; Belongs to the D-isomer specific 2-hydroxyacid dehydrogenase family.
1499	fig|6666666.1036479.peg.1729	1041826.FCOL_07070	31.9	151.4	AEW86233.1	Putative adhesin.
1500	fig|6666666.1036479.peg.1730	1041826.FCOL_09450	94.2	493.0	AEW86699.1	3-hydroxybutyryl-CoA dehydratase; COG1024 Enoyl-CoA hydratase/carnithine racemase; Belongs to the enoyl-CoA hydratase/isomerase family.
1501	fig|6666666.1036479.peg.1731	1041826.FCOL_09445	95.2	824.3	AEW86698.1	Two-component system sensor histidine kinase; COG0642 Signal transduction histidine kinase.
1502	fig|6666666.1036479.peg.1733	1041826.FCOL_09435	97.0	671.0	hemH	Ferrochelatase; Catalyzes the ferrous insertion into protoporphyrin IX. Belongs to the ferrochelatase family.
1503	fig|6666666.1036479.peg.1734	1041826.FCOL_09430	96.2	570.1	AEW86695.1	AraC family transcriptional regulator; COG2207 AraC-type DNA-binding domain-containing proteins.
1504	fig|6666666.1036479.peg.1735	1041826.FCOL_09425	97.1	784.6	hemA	glutamyl-tRNA reductase; Catalyzes the NADPH-dependent reduction of glutamyl-tRNA(Glu) to glutamate 1-semialdehyde (GSA).
1505	fig|6666666.1036479.peg.1736	1041826.FCOL_09420	91.7	560.1	hemC	Porphobilinogen deaminase; Tetrapolymerization of the monopyrrole PBG into the hydroxymethylbilane pre-uroporphyrinogen in several discrete steps. Belongs to the HMBS family.
1506	fig|6666666.1036479.peg.1737	1041826.FCOL_09415	71.4	312.0	AEW86692.1	COG1587 Uroporphyrinogen-III synthase.
1507	fig|6666666.1036479.peg.1738	1041826.FCOL_09410	98.2	694.9	hemE	Uroporphyrinogen decarboxylase; Catalyzes the decarboxylation of four acetate groups of uroporphyrinogen-III to yield coproporphyrinogen-III.
1508	fig|6666666.1036479.peg.1740	1041826.FCOL_09400	98.3	649.0	AEW86689.1	COG0408 Coproporphyrinogen III oxidase.
1509	fig|6666666.1036479.peg.1741	1041826.FCOL_09395	98.5	695.3	AEW86688.1	Hypothetical protein.
1510	fig|6666666.1036479.peg.1742	1041826.FCOL_09390	97.0	643.7	AEW86687.1	COG0113 Delta-aminolevulinic acid dehydratase; Belongs to the ALAD family.
1511	fig|6666666.1036479.peg.1745	1041826.FCOL_09375	96.2	472.6	AEW86684.1	Hypothetical protein; COG0417 DNA polymerase elongation subunit (family B).
1512	fig|6666666.1036479.peg.1746	1041826.FCOL_09370	91.5	391.7	AEW86683.1	Hypothetical protein.
1513	fig|6666666.1036479.peg.1747	1041826.FCOL_09365	97.9	899.8	AEW86682.1	Nucleoside recognition domain-containing protein; COG2715 Uncharacterized membrane protein, required for spore maturation in B.subtilis.
1514	fig|6666666.1036479.peg.1748	1041826.FCOL_09245	91.7	974.9	AEW86658.1	Hypothetical protein.
1515	fig|6666666.1036479.peg.1749	1041826.FCOL_09250	89.4	417.5	AEW86659.1	COG1040 Predicted amidophosphoribosyltransferases.
1516	fig|6666666.1036479.peg.1751	1041826.FCOL_09260	99.4	1036.6	glyQS	glycyl-tRNA synthetase; Catalyzes the attachment of glycine to tRNA(Gly). Belongs to the class-II aminoacyl-tRNA synthetase family.
1517	fig|6666666.1036479.peg.1752	1041826.FCOL_09265	97.4	680.6	thiL	Thiamine-monophosphate kinase; Catalyzes the ATP-dependent phosphorylation of thiamine- monophosphate (TMP) to form thiamine-pyrophosphate (TPP), the active form of vitamin B1; Belongs to the thiamine-monophosphate kinase family.
1518	fig|6666666.1036479.peg.1753	1041826.FCOL_09785	83.8	610.5	AEW86766.1	Hypothetical protein.
1519	fig|6666666.1036479.peg.1754	1041826.FCOL_09785	80.7	587.0	AEW86766.1	Hypothetical protein.
1520	fig|6666666.1036479.peg.1755	1041826.FCOL_09790	83.5	602.1	AEW86767.1	Hypothetical protein.
1521	fig|6666666.1036479.peg.1756	1041826.FCOL_09790	94.8	690.3	AEW86767.1	Hypothetical protein.
1522	fig|6666666.1036479.peg.1757	1041826.FCOL_09785	95.1	689.9	AEW86766.1	Hypothetical protein.
1523	fig|6666666.1036479.peg.1758	1041826.FCOL_09780	97.2	1526.5	AEW86765.1	Hypothetical protein.
1524	fig|6666666.1036479.peg.1760	1041826.FCOL_09770	98.6	702.6	AEW86763.1	Hypothetical protein.
1525	fig|6666666.1036479.peg.1761	1041826.FCOL_09765	96.1	574.3	AEW86762.1	Hypothetical protein.
1526	fig|6666666.1036479.peg.1762	1041826.FCOL_09760	92.3	574.3	AEW86761.1	Hypothetical protein.
1527	fig|6666666.1036479.peg.1763	1041826.FCOL_09755	94.8	413.7	AEW86760.1	NLP/P60 protein; COG0791 Cell wall-associated hydrolases (invasion-associated proteins).
1528	fig|6666666.1036479.peg.1766	1041826.FCOL_09745	96.1	1537.3	AEW86758.1	ATPase; COG0542 ATPases with chaperone activity, ATP-binding subunit; Belongs to the ClpA/ClpB family.
1529	fig|6666666.1036479.peg.1768	1041826.FCOL_09735	98.0	870.5	AEW86756.1	Hypothetical protein.
1530	fig|6666666.1036479.peg.1769	1041826.FCOL_09730	97.7	759.6	AEW86755.1	Hypothetical protein.
1531	fig|6666666.1036479.peg.1772	1041826.FCOL_09715	92.6	395.6	AEW86752.1	Hypothetical protein.
1532	fig|6666666.1036479.peg.1774	1041826.FCOL_09705	96.2	1175.2	AEW86750.1	Hypothetical protein.
1533	fig|6666666.1036479.peg.1775	1041826.FCOL_09700	99.7	794.7	AEW86749.1	COG0739 Membrane proteins related to metalloendopeptidases.
1534	fig|6666666.1036479.peg.1777	1041826.FCOL_09690	99.2	965.7	AEW86747.1	COG2885 Outer membrane protein and related peptidoglycan-associated (lipo)proteins.
1535	fig|6666666.1036479.peg.1778	1041826.FCOL_05530	98.3	713.0	AEW85931.1	Integrase catalytic subunit; COG2801 Transposase and inactivated derivatives.
1536	fig|6666666.1036479.peg.1779	1041826.FCOL_09680	89.3	696.8	AEW86745.1	Hypothetical protein.
1537	fig|6666666.1036479.peg.1780	1041826.FCOL_09645	98.5	663.3	AEW86738.1	Hypothetical protein.
1538	fig|6666666.1036479.peg.1782	1041826.FCOL_09270	84.0	262.7	AEW86663.1	Rhs family protein.
1541	fig|6666666.1036479.peg.1788	1041826.FCOL_09295	86.9	1726.5	AEW86668.1	COG3209 Rhs family protein.
1542	fig|6666666.1036479.peg.1789	1041826.FCOL_09300	32.9	254.2	AEW86669.1	Hypothetical protein.
1543	fig|6666666.1036479.peg.1790	1041826.FCOL_09305	99.7	650.6	AEW86670.1	Rhs element Vgr protein; COG3501 Uncharacterized protein conserved in bacteria.
1544	fig|6666666.1036479.peg.1793	1041826.FCOL_09315	81.2	383.6	AEW86672.1	Hypothetical protein.
1545	fig|6666666.1036479.peg.1794	1041826.FCOL_09320	89.9	433.7	AEW86673.1	Hypothetical protein.
1546	fig|6666666.1036479.peg.1796	1041826.FCOL_09330	97.4	928.7	AEW86675.1	Peptidase dimerization domain-containing protein; COG0624 Acetylornithine deacetylase/Succinyl-diaminopimelate desuccinylase and related deacylases.
1547	fig|6666666.1036479.peg.1797	1041826.FCOL_09335	88.0	1371.7	AEW86676.1	Tonb-dependent receptor plug; COG4771 Outer membrane receptor for ferrienterochelin and colicins.
1548	fig|6666666.1036479.peg.1798	1041826.FCOL_09340	95.4	415.6	AEW86677.1	COG1321 Mn-dependent transcriptional regulator.
1549	fig|6666666.1036479.peg.1799	1041826.FCOL_09345	92.6	1105.9	mntH	Manganese transport protein mntH; H(+)-stimulated, divalent metal cation uptake system. Belongs to the NRAMP family.
1550	fig|6666666.1036479.peg.1801	1041826.FCOL_09355	96.0	1296.6	AEW86680.1	Ferrous iron transport protein B; Probable transporter of a GTP-driven Fe(2+) uptake system. Belongs to the TRAFAC class TrmE-Era-EngA-EngB-Septin-like GTPase superfamily. FeoB GTPase (TC 9.A.8) family.
1552	fig|6666666.1036479.peg.1808	1041826.FCOL_09205	98.0	2177.1	AEW86650.1	Hypothetical protein.
1553	fig|6666666.1036479.peg.1809	1041826.FCOL_09200	99.4	694.9	AEW86649.1	Patatin; COG3621 Patatin.
1554	fig|6666666.1036479.peg.1810	1041826.FCOL_09195	98.7	450.3	AEW86648.1	Peptidase S24/S26A/S26B, conserved region; COG2932 Predicted transcriptional regulator; Belongs to the peptidase S24 family.
1555	fig|6666666.1036479.peg.1811	1041826.FCOL_09185	96.1	503.1	AEW86646.1	Nitrilase/cyanide hydratase and apolipoprotein N-acyltransferase; COG0388 Predicted amidohydrolase.
1556	fig|6666666.1036479.peg.1812	1041826.FCOL_09180	97.7	763.1	AEW86645.1	COG0726 Predicted xylanase/chitin deacetylase.
1557	fig|6666666.1036479.peg.1813	1041826.FCOL_09175	98.4	761.9	AEW86644.1	COG4676 Uncharacterized protein conserved in bacteria.
1558	fig|6666666.1036479.peg.1815	1041826.FCOL_09165	97.8	451.1	AEW86642.1	Hypothetical protein.
1559	fig|6666666.1036479.peg.1816	1041826.FCOL_09160	91.6	445.3	AEW86641.1	Hypothetical protein.
1560	fig|6666666.1036479.peg.1818	1041826.FCOL_09150	98.8	511.1	AEW86639.1	COG0479 Succinate dehydrogenase/fumarate reductase, Fe-S protein subunit.
1561	fig|6666666.1036479.peg.1819	1041826.FCOL_09145	99.0	1343.9	sdhA	COG1053 Succinate dehydrogenase/fumarate reductase, flavoprotein subunit.
1562	fig|6666666.1036479.peg.1820	1041826.FCOL_09140	98.9	529.6	AEW86637.1	Succinate dehydrogenase cytochrome B subunit.
1563	fig|6666666.1036479.peg.1821	1041826.FCOL_09135	92.9	1655.6	AEW86636.1	Glycosyl hydrolase BNR repeat-containing protein.
1564	fig|6666666.1036479.peg.1823	1041826.FCOL_09125	99.1	873.2	AEW86634.1	COG0006 Xaa-Pro aminopeptidase.
1565	fig|6666666.1036479.peg.1824	1041826.FCOL_09120	98.0	733.8	AEW86633.1	Hypothetical protein.
1566	fig|6666666.1036479.peg.1825	1041826.FCOL_09115	91.9	479.9	AEW86632.1	Hydrolase; COG0596 Predicted hydrolases or acyltransferases (alpha/beta hydrolase superfamily).
1567	fig|6666666.1036479.peg.1826	1041826.FCOL_09110	96.0	1734.5	AEW86631.1	Hypothetical protein; COG3893 Inactivated superfamily I helicase.
1568	fig|6666666.1036479.peg.1827	1041826.FCOL_09105	99.4	644.4	AEW86630.1	COG2885 Outer membrane protein and related peptidoglycan-associated (lipo)proteins.
1569	fig|6666666.1036479.peg.1828	1041826.FCOL_09100	98.5	783.9	kbl	2-amino-3-ketobutyrate coenzyme A ligase; Catalyzes the cleavage of 2-amino-3-ketobutyrate to glycine and acetyl-CoA.
1570	fig|6666666.1036479.peg.1829	1041826.FCOL_09095	97.7	2019.2	AEW86628.1	COG1074 ATP-dependent exoDNAse (exonuclease V) beta subunit (contains helicase and exonuclease domains); Belongs to the helicase family. UvrD subfamily.
1571	fig|6666666.1036479.peg.1830	1041826.FCOL_09090	98.5	422.2	AEW86627.1	Superoxide dismutase; Destroys radicals which are normally produced within the cells and which are toxic to biological systems. Belongs to the iron/manganese superoxide dismutase family.
1572	fig|6666666.1036479.peg.1832	1041826.FCOL_09080	99.0	1165.6	uvrC	Excinuclease ABC subunit C; The UvrABC repair system catalyzes the recognition and processing of DNA lesions. UvrC both incises the 5' and 3' sides of the lesion. The N-terminal half is responsible for the 3' incision and the C-terminal half is responsible for the 5' incision.
1573	fig|6666666.1036479.peg.1833	1041826.FCOL_09075	92.5	1406.0	AEW86624.1	COG1752 Predicted esterase of the alpha-beta hydrolase superfamily.
1574	fig|6666666.1036479.peg.1834	1041826.FCOL_09070	97.7	898.7	AEW86623.1	Putative amino acid-transporting permease; COG0531 Amino acid transporters.
1575	fig|6666666.1036479.peg.1836	1041826.FCOL_09065	99.8	1173.7	lepA	GTP-binding protein LepA; Required for accurate and efficient protein synthesis under certain stress conditions. May act as a fidelity factor of the translation reaction, by catalyzing a one-codon backward translocation of tRNAs on improperly translocated ribosomes. Back-translocation proceeds from a post-translocation (POST) complex to a pre- translocation (PRE) complex, thus giving elongation factor G a second chance to translocate the tRNAs correctly. Binds to ribosomes in a GTP- dependent manner.
1576	fig|6666666.1036479.peg.1837	1041826.FCOL_09060	98.8	664.5	AEW86621.1	tRNA-dihydrouridine synthase; Catalyzes the synthesis of 5,6-dihydrouridine (D), a modified base found in the D-loop of most tRNAs, via the reduction of the C5-C6 double bond in target uridines; Belongs to the dus family.
